{
  "id": "00000000000000000000000041",
  "versao_id": "00000000000000000000000020",
  "metodo_versao": "v1",
  "prompt_versao": "v1",
  "schema_versao": 2,
  "tamanho_parte_tokens": 45000,
  "concorrencia": 1,
  "plano_partes": [
    "00000000000000000000000030"
  ],
  "criada_em": "2026-09-20T18:00:00Z",
  "modo": {
    "id": "literaria",
    "revisao": 1
  },
  "nivel_de_atencao_alvo": 3,
  "executor": {
    "modelo": "gpt-6-astra",
    "esforco": "high",
    "cli_versao": "0.144.0"
  }
}
